"nixonrichard,handguns and assault weapons you know anything that might be used to take down an unrepresentative government."
"throop77,Well who to vote for then? RP is at least honest and you know what you will get. We will stop the empire building and end the war. What other candidate will do that (besides Kucinich who seems to have no chance) ?  Hillary won't give a straight answer on anything Guiliani is George Bush Romney is fake... Obama? He seems ok I guess but he won't give a straight answer on Iraq.  Edwards I like his stance against corporate influence... I dunno not much out there. "
"JonFugeEverybody,Well the constitutional VP doesn't really do anything.  Kucinich would be more powerful as a congressman if Ron was elected president."
"lliiffee,&gt; Churchill was half AmericanOh damn your comment includes actual factual content.  Downmod downmod!P.S. It is quite clear that because you say the Brits have a worse record than the Americans you therefore feel any bad things the Americans have done are absolutely fine!&lt;/sarcasm&gt;"
"talibanjo,&gt; What makes more sense to you only showing 4 names on the pie chart or showing someone w/ 2% on one and hiding someone w/ 10% on the other?Uh the former.  Richardson *was fourth* with 2%.  They showed the *top four* of each not just any four."
"powerhead,Panic!"
"DogBotherer,""Obama has a lock on the change brand"" - You're joking surely?"
"Slipgrid,I'll tell you what I'm getting.  I'm getting a beer in about ten minutes when my girl shows up."
"averyv,no doubt 20% would have been huge. third place also would have been huge. either of those things i think would have made ignoring ron paul a very difficult thing. but here's hoping for new hampshire.. hopefully this draws the ron paul supporters out (being prepared for such an uphill battle) instead of making them retreat to another candidate or (more likely i would think) away from the scene entirely"
"haoest,ha this shit got so old that no one bothers to comment anymore.I voted up though."
"dirtymoney,LOL! FUNNY &amp; clever! Wish I had thought of it!Boo-hoo-frickity!  Get over yourself! Dont take offence at every little jab against your religion. Know what you should have done? Walked up to the pole pulled the sign down &amp; throw it away thought nothing of it &amp; that's it!Hell! the christian religion is the #1 target now in the US. "
"onelasttime,There are rational reasons why one would believe in creationism (when it stems from their assumptions of reality). You might disagree with those assumptions but the results are consistent and rational."
"brad-walker,&gt;hedge fund whose portfolios are responsible for sub-prime predatory lending practices Medicare privatization and an entire range of corporate sharp dealingsHis talk last night about the recession with the housing bubble et al. was quite entertaining."
"evilnight,Financially professionally or literally?Soap ballot jury ammo. That's the order. ;)"
"polar,Laugh at Gandhi."
"SLAUTCAANS,voting fraud.  Just like Ohio 2004."
"swac,It makes no sense that Hillary had more support in urban areas.  CNN's exit polls showed that Obama's supporters tended to be young people and people with higher education.  These types of people tend to live in urban areas.  Hillary's voters tended to be older people without much/any higher education.  This tends to mean rural areas."
"thefro,thank you. he had like +10 for some reason. perhaps it's just point inertia."
"7oby,What exception of abortion?  How is abortion more of a federal issue than gay marriage?  More than drug legalization medical marijuana?  He just sees it as something that the constitution delegated to the states as being not part of the federal government.  Simple."
"ayrnieu,&gt; Reason Magazine just implied the initiation of force is a good idea.At worst they implied that one coercion is better than another.&gt; [Reason Magazine] just implied [the initiation of force] is a good idea.Aw does widdle sn0re feel snippy today?  Someone noticed that your contemptuous suggestion was a tautology!"
"thorshammer,Wow. Found and submitted this related clip:http://reddit.com/goto?id=65brxJust listen to the guy abuse the soldier.."
"cmiller1,And now I think you're a virgin but it's not because you're a troll but because you're ugly which caused the lack of friends and relationships leading to the having no life and a total lack of social skills and virginity."
"Godspiral,He's lying.  There is no way the US is attacking Iran.  This is just part of their continued surrender and die posture towards the country."
"all_ways_thinkin,I attempted to go to the original site where is was posted... and got this: Not FoundThe requested URL /Transcript of Japanese Parliamentary discussion of 911.html was not found on this server.too much traffic? not bloody likely..."
"matts2,&gt;But I don't think they became anti-semites without some help from those who come up with the arguments linking Israel/Judaism.What in the world leads you to that conclusion?&gt;My broader point is that even if the article is singling out Jews my point is that it is Zionists themselves who have drawn this equivalence between Israel &amp; Judaism as you have done above.I did not do that the article did. You have confused my objecting to the clearly anti-Semitic article with my bring up something myself. Near as I can tell in your view people should not attack anti-Semites or defend Israel because that might lead to more anti-Semites.You are simply whining about some unfair charge even when you admit that the charge in this case was fair. I see this preemptive whining more than I see people conflating attacks on Israel with attacks on Jews.As for that latter there is a strong tinge of anti-Semitism that permeates both the Arab violence against Israel and criticism of Israel. In 1900 the whole Middle East was nominally run by the Turks. A small number of Jews start moving returning even to ""Palestine"". They did not move in by violence they were not agents of the British or some other power they were mostly ideological socialists trying to escape from Czarist violence. They bought land from the legal Turkish landowners. And the Arabs were pissed and turned to violence. They were pissed in part because ""their"" land was being sold but it was being sold by the legal owner. (And most of the land being settled was not occupied by anyone it was the swamps and other abandoned parts of the area). The Arabs were mostly pissed because while poor and mistreated by the Turks at least they were Moslems not dhimmi. That is they had a long term deeply held religious/cultural view that they were the superior people and that all others (Christians and Jews mostly) were inferior and had to show that they were inferior. This dhimmi status was enforced by both law and custom. But these new immigrants these new Jews refused to take that position. They were to borrow a disparaging term from the U.S. uppity. They protected themselves rather than hiring guards they made self-sufficient and later economically successful communities. They refused to play their role. That was intolerable and combined with the devastating Turkish defeat in WWI lead to large scale Arab violence against the Jews. Remember before WWI the Jews were legal immigrants they were not forcing their way in they were not abusing anyone. The situation has escalated since then for a large number of reasons and no side is pure or perfect but Arab anti-Jewish (anti-non-Muslim if you will) views are at the start and core of the conflict.As for current anti-Israel views anti-Semitism does play a large role. Everyone knows the name of Ariel Sharon no one knows the name of the Christian leader who ordered the attacks on the refugee camps nor the name of the Muslim leader who ordered the assassination that lead to that massacre. People talk of how terrible Israel is but no one speaks of Egypt or Syria. British *journalists* call for a boycott of Israel a country with a free press but are silent about China or Zaire. Israel is singled out and it is not because Israel is anything close to the worst country around. In part we hear move about the bad things Israel does because it is a more open society reporters are safe there and safe to criticize the government.But there is also using a different set of standards for Jews than for others.Some Americans will say that they justify their criticism of Israel on the money Israel gets from the U.S. government. And on the surface that seems reasonable. But they don't criticize Egypt. They don't criticize Saudi which gets money from them when they buy gas.  And why all the articles here about how there is this Jew or that Jew in government or in the media? In fact why the article you defended which go so much support and defense which simply listed Jews who are in government. How can you not see the anti-Semitism there?(Regarding edit I did not see the original so that is fine."
"enzomedici,Invade Sweden! Now! Capture their women and bring them back! "
"ef4,The government is controlled by the powerful by definition.  So stop being surprised that government directs wealth toward the powerful."
"intellectual,""Because"" this is the most tired and unoriginal way of phrasing a point and makes you sound like an idiot if you're wrong.You must be awfully young to not know that you don't need a deep-fryer to deep fry all you need is a pot and oil.  Try leaving McDonald's for once in your teenage life and cook a meal for yourself."
"chersolly,Do something!"
"throwaway,Woah I lost 15 points of karma so far from this little joke. :-)"
"uwjames,Let me fix that for you:""What *the fuck* does that mean?"""
"illegible,that's kind of like saying i made money because i purchased my new table saw at 20% discount."
"breakfast-pants,If Paul had 80% the mainstream media could still pretend he wasn't a serious candidate."
"Goeran,Vote fraud 2.0 is coming."
"rainman_104,Profit taking?  Margin calls are the bigger problem IMO.  "
"kmakmfa,I went to College in a small rural college town where a small but vocal group of the residents were up in arms against fluoride. They blamed it for rotting the teeth (and brains) of the townie teenagers &lt;sarcasm&gt;because it just wasn't possible that some of the teenagers were using methamphetamine&lt;/sarcasm&gt;."
"reflibman,Must be a record for the most down votes in the least amount of time.Paul-tards - no sense of humor."
"shiner_man,In other news Ron Paul campaign is still hovering at 4% nationally.  Come back to reality people.  Your dream is over."
"culture,like microsoft sayssit back and relax (while win 98 installs)sit back and see him humiliate himself"
"geekvicious,It boils down to what is immoral/unethical: displaying human bodies or driving the population into war?"
"joshgi,Just ask our good friend kruschev"
"mrbroom,I think you mean ""should be *convicted as* a war criminal too"" since it's not hypothetical as to whether or not either of them are in fact war criminals already."
"sakebomb69,&gt;Amazingly you forgot that there are other countries which have WMD's to protect themselves and possibly attack other countries. Whatever Saddam's gamble was it did not matter.Such as? And which of them invaded other countries or gassed their own population in the 100's of thousands?&gt;I think you never heard that GWB wanted to take him out no matter what. There are numerous personal accounts that document this.And vice versa. They both didn't like each other. So what? "
"GodHatesFigs,Indeed cheap labor is important to maintain a functioning economy and a strong America that abides by the Constitution."
"Un_Suppressed,Ron Paul is the one you want for that. He wants to chain down the beast (government) with the constitution and bring the troops home. RonPaul2008.com"
"cbroberts,Did you read the article?  Ron Paul beat Fred Thompson!  It's the REVOLUTION baby!  It's spreading like wildfire!What is this like your first time on the internets?"
"LWRellim,Umm duh yeah... that's why this site has a two-sided flyer instead of a 50 page pamphlet.(Might help if you actually visited the site and read the doc.)And actually we think [hope?] that PEACE PROSPERITY and FREEDOM might just gain *some* traction against DEATH DEBT and TERROR."
"shiner_man,&gt;So balanced coverage is giving a good positive to negative ratio?Ummm...yes I think that's a good way of putting it.  You see when 99.9% of Ron Paul stories are talking about how great of a man he is I would argue that that is **not** balanced coverage."
"antifolkhero,Pope then waves his magical scepter and pulls a rabbit out of his asshole.  "
"eanoper,""the good name of the Republican Party""Haha yeah that's a good one.  Eight years of neoconservative rule has done far more to ""defile"" the Republican brand name than a soft-spoken well-reasoned advocate for limited government and limited foreign interventionism could ever accomplish regardless of any faults.  I can't help but think that your view of the big picture is seriously warped."
"BigFeets,Fantabulous! - Don King"
"Johny_Cash,Stop paying taxes."
"anonymous-coward,And helping bring down the USSR arguably a bigger problem than a bunch of bearded donkeyjockies."
"krugerlive,you know for ""happyofficeworker"" i've never seen you post anything *that* 'happy'"
"polar,Thatcher."
"Bensch,At this point I don't think you're rational. I'm sorry. Good day."
"valeriepieris,http://www.thefreedictionary.com/vitriolicI don't have a big problem with language I have a problem with meanies!And I wasn't talking to you. It did look like a spat was developing but some of the comments got downmodded to oblivion. Hooray!"
"linkedlist,meh my uni is at least half full of exchange students in for the long haul so I beg to differ."
"Coloradofire,Fuck you dannykeithjames you racist son of a bitch."
"MrObamasQuran,Her policies are perfect and she has angelic character but she's a woman. That's why I hate Hillary and Hillary supporters remind me of this every day. "
"esparza74,Find out where your republican delegate conventions are for your respective states!"
"ukdkbr,Oh your title was a little confusing then it seemed like you WANT Paul supporters to vote for Obama."
"ssdgoalie,Population control that pays."
"nomdeplume,115 Americans died in car accidents today."
"b_billy_bosco,In other news White House follows orders from foreign sovereign wealth funds"
"I_AM_A_NEOCON,Thus the reason one should vote for a Republican. In our party we don't do that shit."
"dmehrtash,What is point of answering if you want to deny reality?This ""Gentleman"" is not one Israeli.  He is a cabinet minister.you said:&gt;You have imputed a goal upon the Israelis (forcing all Arabs out) which is unfounded. comments from the Minister the action of every Israeli Prime Minister (every one of them who have been associated with Terrorism) is contrary to your statement.&gt;I strongly disagree with Sharon's political stanceThat is great.  I am sure lot of Germans disagreed with Hitler too but that doesn't say the claims of Hitler's crimes  were ""unfounded"""
"blaze4metal,In a way who gets the Democratic nod will determine if another bush-like war-crazy gun-tooting conservative makes it into the office."
"dotcoma,she would do ANYTHING. she's worse than MONICA. "
"Cygnarite,Wow. What unbelievable assholes. You have every right to voice your opinion. That is what the 1st amendment is all about. It isn't however about -enforcing- your opinion. Sure Public opinion is on your side this time but what if a bunch of KKK blocked an entrance to a restaurant for Non whites? They'd be just like you! Enforcing their opinion on those ""despicable immigrants and minorities"". Get a clue. "
"wutzurproblem,hehe"
"darkgatherer,ohh he's decided to defend the constitution now after opposing the impeachment of Cheney who has been urinating  on the document for the last 7 plus years. Paul certainly is selective in his defense of the constitution. "
"ginowhitaker,They eat their own."
"malcontent,They can attack all they want. It doesn't matter. It will have no impact on the swing voters. To them it's all blah blah blah I already heard all this a thousand times before."
"safishb,Israel pulled down Israeli settlements in the Gaza strip and then pulled out of the Gaza strip. After all that the Palestinians are still firing rockets from the Gaza strip into Israel.In such a situation they have little incentive to to give up more land for a 'peace' where the new owners of the land fire rockets into Israel."
"jack_championship,Of course.  Drug laws are sumptuary laws.  They are laws against sin.  Drug use is a victimless crime.  Drug prohibition is an abomination unto the lord."
"laketrout,Gore will not take a step backwards to be a running mate.  While Edwards would make an excellent VP I think he'd be looked upon as twice failing in his bids.  Obama-Bloomberg?"
"primoris_causa,Regardless I'd still have the post.. not a cabinate level though so I could do an end-run around the approval process.  The person would have to be fully vetted but trumped up felonies wouldn't count."
"Mithel,Of course you do Kos of course you do. "
"Kardlonoc,Yeah these attacks are putting mccain in a better light for me. It seems like every attack is unfounded unbiased or swiftboat old. Mccain is running the fair race and now all the dems are frantically playing dirty. I don't like it. "
"johnself,Yeah this is so unfair. Why are we not allowed to hate all Jews or at least all Israelis after a photo like this? Terrible."
"lex99,I don't know what all you people expect.  I mean the Israeli military has to shoot **someone** don't they?  "
"Die-Bold,Dear God.I acknowledge that I haven't offered any statistics of my own but I can comfortably call you a liar and beg that you prove me wrong."
"Nitroadict,You are suffering from faulty assumption and/or liberal bias that Nader somehow got Bush into power where most of the fault lies with the Supreme Court.  Other viewpoints can be illuminating."
"mr1337,I only read the first 5 words of the title and I knew that Hell did indeed freeze over.""Hell freezes over: O'Reilly apologizes"""
"akshayr,Wow.  You really are a whiny little bitch.  "
"antihostile,Didn't we just establish she's non-clit?"
"BigFeets,The #1 post you show doesn't list any reasons!  It's happy talk not substance.Again feminazi is a completely applicable term.  Usually the folks who get upset by it are feminazis themselves.I never said I was on the verge of deciding Clinton is a feminazi.  I merely said that your militant ignorance toward my statements has given me a different perspective on the issue.  Perhaps you need reading comprehension classes."
"BigFeets,Did you know that Castro backwards means ""shitbag""?Ort - any type of wastesac - bagJust sayin'And for the sensitive I'm not trying to imply that all Castros are shitbags.  But to add a little umm flavor do know that Raul is the Spanish variant for Ralph.Ralph Shitbag."
"ZebZ,It's not enough to denounce it.  You have to denounce AND REJECT it."
"Reporter,Now THAT calls for invoking Godwin's adage!  Woot!"
"zerogravity,Hey it written by 'allhands' and evidently no eyes. :)"
"SacrificialGoat,I hate XKCD but this is exactly dead on http://xkcd.com/322/"
"mjsolaro,I've been doing some calls for Obama in Ohio. Obviously the few hundred people I've phoned are not statistically significant but the anecdotal evidence is that Hillary still has a major lead there.Why? It seems pretty much a matter of comfort and familiarity. "
"NoMoreNicksLeft,Haha. I agree with you completely. But it must be too subtle you're modded up to +4 right now."
"Chetan7,Most of that money is going back to U.S. contractors anyway."
"ace_wolfgang,Evidently they can't make choices for themselves now the State of America will do it for them alongside the states of Canada and Mexico."
"andrewd,He lost to McCain for the presidential nod in his own district John McCain 51.23%  to 12.15%.Kind of weak... but then it shows they love having him as their rep. and not as anything else which is nice!"
"Gibbwake,Youre horribly misinformed. Ron is the most pro womans rights candidate running. And its not just women - its individual rights. If you only want women to have the right to  abort babies while everyone including women are left without a bill of rights are you better off? Answer that fool. You want individual rights for everyone.Ron is against federal funding of stem cell research federal funding of anything. The government has no business doing that since its payed for with everyones money and they have no say in it. Donate your money to private research companies if you want or can you not handle the freedom to handle your OWN money?"
"davidreiss666,The ""black baby thing"" was done in South Carolina.  It was from an unofficial push poll that the Bush-folks claimed wasn't them and that they had no idea who did it but it was being done for several weeks before the South Carolina primary.  Considering that you don't know much about this infamous incident... I don't think I would much trust your opinions. Especially when you think Politics is about cooperation and being nice and stuff.  Politics is war continued by other means!   If you want to get things done then you need a leader who understands that.  "
"jeanette3654,There is still a candidate on the ballot(in spite of what the lying msm says) who has a lot of foreign policy experience and it even favors the US! Imagine that! Ron Paul."
"mindslight,If Obama really is Change why is Pelosi standing up for him?"
"mindslight,""If these were puppies"" ?Give me a break.People got upset about the puppy because it was _clearly_ unwarranted. A video of a soldier walking into a house and killing a family would have elicited even more of a response.I'm sure most of those civilian deaths are ""collateral damage"" not outright senseless killing. There's surely serious process issues when there's _so many_ civilian deaths but this is a much more nuanced point and shouldn't be confused with the casual killing of a puppy.(I've been fully against the war + occupations from the start but that doesn't stop me from calling out your stupid headline)"
"DrLegoHari,Don't judge it until you've checked under the hood"
"ellanana,ya i believe so but it does show the gyre pretty well and how large the currents are ..."
"mattshields,i hate fox news as much as the next guy but to play devil's advocate i was gonna find this story somewhere on the fox news site to show that they aren't THAT biased.  oops.  my bad."
"thekrone,&gt;There is a bit of irony in your point of view here as a HRC supporterI'm sorry I mislead you but I am definitely definitely not a Clinton supporter. I would say that since Kucinich dropped out Obama has been my preferred candidate. In fact if Hillary wins the nomination I'll probably look to vote third party.I started this post to try to get more positivity from more hardcore Obama supporters on reddit. I'm looking for more reasons to vote for the guy."
"msrite,Boeing said it sees serious flaws in the Air Force's selection process.  The protest Boeing submitted to the GAO is the first it has submitted in 30 years of Government contracting.   "
"GuineaPig84,Nadar has every right to run."
"Battleloser,This isn't Hillary this is Obamas skeletons knocking down the closet door.If he were in office longer I guarantee he'd have more."
"GrammarIsForNazis,So thats what they told you that frosting was... Perhaps its better to just let that slide."
"RonObvious,The kookery is particularly strong in this thread. "
"kermityfrog,Goooo Free Democracy!"
"shokk,Stupid assumption.  And isn't that chapter yet to be written?  "
"WasForClinton,McCain's just the latest goon in the goon squad that has taken over our country!He's a REPUG-nican who is SO OLD maybe we should call him ""McCorpse""!REPUGnican=Secret Airport Bathroom Poop Sex (McCaning each other)REPUG=1000s OF CRIPPLED VETERANS TWO ONGOING WARS emails intercepted!****NO COPYRIGHT. ALL OR ANY PART OF THIS DOCUMENT MAY BE COPIED &amp; REPOSTED FREELY.****"
"ItsAConspiracy,If you have problems with Paul himself but like the platform issues I mentioned feel free to join the fun. It's not about him anymore."
"uwjames,As you know I'm actually discussing gender issues with you in [another thread](http://reddit.com/info/6ckot/comments/c03hg9m).  Do you actually believe your own BS?"
"Sqwirl,I don't speak for Hedgehog2006 but to suggest that it's 'uneducated rhetoric' to call the Bush administration one of the most secretive in our history is well uneducated."
"link2zelda,reddit caught censoring http://reddit.com/info/6ctla/comments/"
"NoMoreNicksLeft,Really? Because it would seem to me that anyone who thinks they're clever enough to pick the lesser of evils is actually a fool.You won't avoid war by going with Hillary or Obama over McCain. The erosion of your rights will continue. The economy being fucked up will continue. Your taxes won't go down nor will the money they take from you be spent more wisely or responsibly.Unless you have a Guinness Book of Records fetish and want to see either the first woman or first black president it's utterly mysterious why you'd prefer one over the other."
"duus,So?"
