"nobody7,Most important video to watch: What is AIPAC: Documentary 'The Israel lobby - The influence of AIPAC on US Foreign Policy.' (hour long)  is real:http://video.google.com/videoplay?docid=2894821400057137878John Hagee Religious Right McCain supporter at AIPAChttp://www.youtube.com/watch?v=exdsB5D1r7YReligious Right on Israel and End-Times-Theology http://www.youtube.com/watch?v=mjMRgT5o-IgSome brainwashed Evangelicals on Obama end-times Israelhttp://www.youtube.com/watch?v=nphxj9mpAgEMcCain: Lower corporate tax and support / protect Israelhttp://www.youtube.com/watch?v=69h45JSwvto"
"pillage,So? Fox has some of the highest rated shows on all of cable news and Obama doesn't want to expose all those people to his message? Commend someone for not going into the lions den and not standing up to them? He has gone on biased news sources like the Huffington post and MSNBC but refuses to go on fox. He needs to start taking on his opponents and not just preach to the quire. "
"Nemo84,Again lots of emotional display and carefully skirting around any real arguement. I repeat my challenge: either prove these evil muslims of yours are a threat to my country or admit you're wrong. Untill you do I'm simply going to ignore your trolling."
"garyp714,agreed. All the free publicity is for the Democrats...and McCain just sounds like a retard no matter what he does to get some play."
"lumpy1981,I don't know enough about it but from the sound of it ""gun BAN"" I would say I am against it.  I don't think guns should be banned.  An ordinary law abiding citizen should be allowed to own a gun.  I think it should be a right that can be taken away when a person commits a violent crime."
"argoff,The industrial revolution and the rise of the middle class that it brought about did far more to end things like virtual slavery child labor etc ... than did the government.   Back then most people still used horses too ... it's silly to think labor conditions wouldn't change any from a pre-industrial throwback.  "
"brianchester666,i wonder if this guy would have killed or injured the cop if he had not been tasered. someone tell me why cops need these and why they are allowed to use them on anyone."
"MarlonBain,&gt;I think people see different sexes and colours differently. That doesn't mean they are racist or sexistUh isn't that *exactly* what it means?"
